<?xml version="1.0" encoding="UTF-8"?>
<xs:schema xmlns:xs="http://www.w3.org/2001/XMLSchema" targetNamespace="http://example.com/flight"
           xmlns="http://example.com/flight"
           elementFormDefault="qualified">

  <!--
    Simple types for standardized codes and enumerations
  -->

  <!-- IATA airport or city code (exactly 3 uppercase letters) -->
  <xs:simpleType name="LocationCodeType">
    <xs:restriction base="xs:string">
      <xs:pattern value="[A-Z]{3}"/>
    </xs:restriction>
  </xs:simpleType>

  <!-- IATA airline code (exactly 2 uppercase letters) -->
  <xs:simpleType name="AirlineCodeType">
    <xs:restriction base="xs:string">
      <xs:pattern value="[A-Z]{2}"/>
    </xs:restriction>
  </xs:simpleType>

  <!-- Flight number (1 to 4 digits, as a string) -->
  <xs:simpleType name="FlightNumberType">
    <xs:restriction base="xs:string">
      <xs:pattern value="\d{1,4}"/>
    </xs:restriction>
  </xs:simpleType>

  <!-- Passenger type enumeration: ADT=Adult, CHD=Child, INF=Infant -->
  <xs:simpleType name="PassengerTypeEnum">
    <xs:restriction base="xs:string">
      <xs:enumeration value="ADT"/>
      <xs:enumeration value="CHD"/>
      <xs:enumeration value="INF"/>
    </xs:restriction>
  </xs:simpleType>

  <!-- Flight type enumeration: nonstop, one-stop, multi-stop -->
  <xs:simpleType name="FlightTypeEnum">
    <xs:restriction base="xs:string">
      <xs:enumeration value="NonStop"/>
      <xs:enumeration value="OneStop"/>
      <xs:enumeration value="MultiStop"/>
    </xs:restriction>
  </xs:simpleType>

  <!-- Booking class (single uppercase letter) -->
  <xs:simpleType name="BookingClassType">
    <xs:restriction base="xs:string">
      <xs:pattern value="[A-Z]"/>
    </xs:restriction>
  </xs:simpleType>


  <!--
    Complex types for grouping related request elements
  -->

  <!-- Represents a count of passengers of a given type -->
  <xs:complexType name="PassengerCountType">
    <xs:attribute name="Type" type="PassengerTypeEnum" use="required"/>
    <xs:attribute name="Quantity" type="xs:positiveInteger" use="required"/>
  </xs:complexType>

  <!-- Represents a time window with a start and end time -->
  <xs:complexType name="TimeRangeType">
    <xs:sequence>
      <xs:element name="StartTime" type="xs:time"/>
      <xs:element name="EndTime"   type="xs:time"/>
    </xs:sequence>
  </xs:complexType>

  <!-- Represents a specific flight (airline, number, date) and optional booking class -->
  <xs:complexType name="SpecificFlightType">
    <xs:sequence>
      <xs:element name="AirlineCode"  type="AirlineCodeType"/>
      <xs:element name="FlightNumber" type="FlightNumberType"/>
      <xs:element name="FlightDate"   type="xs:date"/>
      <xs:element name="BookingClass" type="BookingClassType" minOccurs="0"/>
    </xs:sequence>
  </xs:complexType>


  <!--
    Root type for the overall Flight Availability Request
  -->
  <xs:complexType name="FlightAvailabilityRequestType">
    <xs:sequence>

      <!-- Required: origin city/airport (IATA code) -->
      <xs:element name="Origin" type="LocationCodeType"/>

      <!-- Required: destination city/airport (IATA code) -->
      <xs:element name="Destination" type="LocationCodeType"/>

      <!-- Required: departure date -->
      <xs:element name="DepartureDate" type="xs:date"/>

      <!-- 
        Required: passenger counts. 
        Up to three different passenger types can be specified (ADT, CHD, INF).
      -->
      <xs:element name="Passengers">
        <xs:complexType>
          <xs:sequence>
            <!-- 
              One or more <Passenger> entries, each indicating Type (ADT/CHD/INF) and Quantity. 
              maxOccurs="3" allows specifying up to 3 distinct passenger types 
              (e.g., ADT, CHD, INF).
            -->
            <xs:element name="Passenger" type="PassengerCountType" maxOccurs="3"/>
          </xs:sequence>
        </xs:complexType>
      </xs:element>

      <!-- Optional: restrict departure to a specific time window -->
      <xs:element name="TimeRange" type="TimeRangeType" minOccurs="0"/>

      <!-- Optional: list of preferred connecting cities (each a 3-letter code) -->
      <xs:element name="PreferredConnectingCities" minOccurs="0">
        <xs:complexType>
          <xs:sequence>
            <xs:element name="ConnectingCity" type="LocationCodeType" maxOccurs="unbounded"/>
          </xs:sequence>
        </xs:complexType>
      </xs:element>

      <!-- Optional: list of preferred airlines -->
      <xs:element name="PreferredAirlines" minOccurs="0">
        <xs:complexType>
          <xs:sequence>
            <xs:element name="AirlineCode" type="AirlineCodeType" maxOccurs="unbounded"/>
          </xs:sequence>
        </xs:complexType>
      </xs:element>

      <!-- Optional: preferred flight types (NonStop, OneStop, MultiStop) -->
      <xs:element name="FlightTypes" minOccurs="0">
        <xs:complexType>
          <xs:sequence>
            <xs:element name="FlightType" type="FlightTypeEnum" maxOccurs="unbounded"/>
          </xs:sequence>
        </xs:complexType>
      </xs:element>

      <!-- Optional: narrow request to a single airline code -->
      <xs:element name="SpecificAirline" type="AirlineCodeType" minOccurs="0"/>

      <!-- Optional: narrow request to a single flight (with optional booking class) -->
      <xs:element name="SpecificFlight" type="SpecificFlightType" minOccurs="0"/>

    </xs:sequence>
  </xs:complexType>

  <!-- The root element for the request document -->
  <xs:element name="FlightAvailabilityRequest" type="FlightAvailabilityRequestType"/>

</xs:schema>
